{
  "baseDate": "2025-12-27",
  "todayIndex": 37,
  "ageOffset": 2,
  "forecastStartIndex": 27,
  "chartRange": {
    "minIndex": 10,
    "maxIndex": 47
  },
  "tableRange": {
    "startX": 24,
    "endX": 47,
    "startAge": 25,
    "endAge": 45
  },
  "series": {
    "history": [
      { "x": 10, "y": 358 }, { "x": 11, "y": 412 }, { "x": 12, "y": 478 },
      { "x": 13, "y": 535 }, { "x": 14, "y": 598 }, { "x": 15, "y": 672 }, { "x": 16, "y": 738 }, { "x": 17, "y": 815 },
      { "x": 18, "y": 885 }, { "x": 19, "y": 962 }, { "x": 20, "y": 1035 }, { "x": 21, "y": 1108 }, { "x": 22, "y": 1175 },
      { "x": 23, "y": 1248 }, { "x": 24, "y": 1295 }, { "x": 25, "y": 1328 }, { "x": 26, "y": 1362 }
    ],
    "model": [
      { "x": 27, "y": 1405 }, { "x": 28, "y": 1450 }, { "x": 29, "y": 1504 }, { "x": 30, "y": 1578 },
      { "x": 31, "y": 1650 }, { "x": 32, "y": 1695 }, { "x": 33, "y": 1788 }, { "x": 34, "y": 1882 },
      { "x": 35, "y": 1972 }, { "x": 36, "y": 2075 }, { "x": 37, "y": 2180 }, { "x": 38, "y": 2405 }, { "x": 39, "y": 2425 }, { "x": 40, "y": 2445 }
    ],
    "d1": [
      { "x": 27, "y": 1459 }, { "x": 28, "y": 1613 }, { "x": 29, "y": 1571 }, { "x": 30, "y": 1622 },
      { "x": 31, "y": 1693 }, { "x": 32, "y": 1754 }, { "x": 33, "y": 1856 }, { "x": 34, "y": 1948 },
      { "x": 35, "y": 2198 }, { "x": 36, "y": 2228 }, { "x": 37, "y": 2344 }, { "x": 38, "y": 2419 }, { "x": 39, "y": 2580 }, { "x": 40, "y": 2573 }
    ],
    "d2": [
      { "x": 27, "y": 1564 }, { "x": 28, "y": 1615 }, { "x": 29, "y": 1581 }, { "x": 30, "y": 1646 },
      { "x": 31, "y": 1773 }, { "x": 32, "y": 1787 }, { "x": 33, "y": 1885 }, { "x": 34, "y": 2044 },
      { "x": 35, "y": 2089 }, { "x": 36, "y": 2146 }, { "x": 37, "y": 2365 }, { "x": 38, "y": 2378 }, { "x": 39, "y": 2456 }, { "x": 40, "y": 2573 }
    ],
    "d3": [
      { "x": 27, "y": 1360 }, { "x": 28, "y": 1405 }, { "x": 29, "y": 1462 }, { "x": 30, "y": 1520 },
      { "x": 31, "y": 1592 }, { "x": 32, "y": 1658 }, { "x": 33, "y": 1748 }, { "x": 34, "y": 1842 },
      { "x": 35, "y": 1935 }, { "x": 36, "y": 2032 }, { "x": 37, "y": 2135 }, { "x": 38, "y": 2250 }, { "x": 39, "y": 2320 }, { "x": 40, "y": 2385 }
    ],
    "observedActual": [
      { "x": 27, "y": 1405 }, { "x": 28, "y": 1450 }, { "x": 29, "y": 1504 }, { "x": 30, "y": 1578 },
      { "x": 31, "y": 1650 }, { "x": 32, "y": 1695 }, { "x": 33, "y": 1788 }, { "x": 34, "y": 1882 },
      { "x": 35, "y": 1972 }, { "x": 36, "y": 2075 }, { "x": 37, "y": 2180 }
    ],
    "standardWeight": [
      { "x": 9, "y": 156 }, { "x": 10, "y": 185 }, { "x": 11, "y": 216 }, { "x": 12, "y": 251 }, { "x": 13, "y": 289 },
      { "x": 14, "y": 330 }, { "x": 15, "y": 375 }, { "x": 16, "y": 423 }, { "x": 17, "y": 474 }, { "x": 18, "y": 529 },
      { "x": 19, "y": 587 }, { "x": 20, "y": 648 }, { "x": 21, "y": 713 }, { "x": 22, "y": 780 }, { "x": 23, "y": 850 },
      { "x": 24, "y": 923 }, { "x": 25, "y": 998 }, { "x": 26, "y": 1076 }, { "x": 27, "y": 1156 }, { "x": 28, "y": 1238 },
      { "x": 29, "y": 1322 }, { "x": 30, "y": 1408 }, { "x": 31, "y": 1495 }, { "x": 32, "y": 1584 }, { "x": 33, "y": 1674 },
      { "x": 34, "y": 1764 }, { "x": 35, "y": 1856 }, { "x": 36, "y": 1949 }, { "x": 37, "y": 2042 }, { "x": 38, "y": 2136 },
      { "x": 39, "y": 2230 }, { "x": 40, "y": 2324 }, { "x": 41, "y": 2418 }, { "x": 42, "y": 2512 }, { "x": 43, "y": 2606 },
      { "x": 44, "y": 2700 }, { "x": 45, "y": 2794 }, { "x": 46, "y": 2888 }, { "x": 47, "y": 2982 }
    ]
  },
  "rules": {
    "thresholds": {
      "goodMax": 3,
      "mediumMax": 5
    },
    "rounding": {
      "mode": "ceil_abs",
      "percentDecimals": 1
    },
    "colors": {
      "good": "#3fb950",
      "medium": "#ffc107",
      "bad": "#f85149"
    }
  },
  "traceCatalog": {
    "forecast:d1-avg-accuracy": {
      "trace_id": "forecast:d1-avg-accuracy",
      "display_value": "97.4%",
      "logic_summary": "D-1 예측치와 실측치의 절대 오차율을 평균해 정확도를 계산했습니다.",
      "logic_formula": "accuracy = 100 - avg(|predicted-actual|/actual × 100)",
      "data_source": [
        {
          "source_id": "db:weight_predictions_d1:2026-02-07",
          "type": "db",
          "name": "weight_predictions_d1",
          "url": "https://p-root.local/db/weight_predictions_d1?date=2026-02-07",
          "row_id": "house=H01,date=2026-02-07",
          "highlight_text": "avg_abs_error_pct=2.6",
          "highlight_anchor": "metric=avg_abs_error_pct"
        },
        {
          "source_id": "db:weight_actuals:2026-02-07",
          "type": "db",
          "name": "weight_actuals",
          "url": "https://p-root.local/db/weight_actuals?date=2026-02-07",
          "row_id": "house=H01,date=2026-02-07",
          "highlight_text": "actual_weight_series",
          "highlight_anchor": "series=daily_actual"
        }
      ],
      "is_ai_generated": true,
      "source_version": "model-2.4.1",
      "snapshot_at": "2026-02-07 11:00:00",
      "confidence": 0.86,
      "version_history": [
        {
          "source_version": "model-2.4.0",
          "snapshot_at": "2026-02-06 11:00:00",
          "display_value": "97.1%",
          "logic_summary": "이전 버전 정확도 평균",
          "confidence": 0.83,
          "data_source": [
            {
              "source_id": "db:weight_predictions_d1:2026-02-06",
              "type": "db",
              "name": "weight_predictions_d1",
              "url": "https://p-root.local/db/weight_predictions_d1?date=2026-02-06",
              "row_id": "house=H01,date=2026-02-06",
              "highlight_text": "avg_abs_error_pct=2.9",
              "highlight_anchor": "metric=avg_abs_error_pct"
            }
          ]
        },
        {
          "source_version": "model-2.3.9",
          "snapshot_at": "2026-02-05 11:00:00",
          "display_value": "96.8%",
          "logic_summary": "초기 버전 정확도 평균",
          "confidence": 0.8,
          "data_source": [
            {
              "source_id": "file:accuracy_rollup_20260205",
              "type": "file",
              "name": "accuracy_rollup_20260205.json",
              "url": "https://p-root.local/files/accuracy_rollup_20260205.json",
              "highlight_text": "d1_avg_accuracy=96.8",
              "highlight_anchor": "$.accuracy.d1"
            }
          ]
        }
      ]
    },
    "forecast:matrix-today": {
      "trace_id": "forecast:matrix-today",
      "display_value": "2,180g",
      "logic_summary": "오늘 셀은 CCTV 실측 체중 데이터와 D-1 예측 결과를 함께 표기합니다.",
      "logic_formula": "cell = actual_weight(today) + error(pred_d1, actual)",
      "data_source": [
        {
          "source_id": "db:cctv_weight_actual:2026-02-07",
          "type": "db",
          "name": "cctv_weight_actual",
          "url": "https://p-root.local/db/cctv_weight_actual?date=2026-02-07",
          "row_id": "house=H01,date=2026-02-07",
          "highlight_text": "actual_weight=2180",
          "highlight_anchor": "age=35"
        },
        {
          "source_id": "file:forecast_rollup_20260207",
          "type": "file",
          "name": "forecast_rollup_20260207.json",
          "url": "https://p-root.local/files/forecast_rollup_20260207.json",
          "highlight_text": "d1_error_pct",
          "highlight_anchor": "$.rollingForecast.d1"
        }
      ],
      "is_ai_generated": true,
      "source_version": "model-2.4.1",
      "snapshot_at": "2026-02-07 11:00:00",
      "confidence": 0.84,
      "version_history": [
        {
          "source_version": "model-2.4.0",
          "snapshot_at": "2026-02-06 11:00:00",
          "display_value": "2,164g",
          "logic_summary": "이전 버전 오늘 셀 예측값",
          "confidence": 0.81,
          "data_source": [
            {
              "source_id": "file:forecast_rollup_20260206",
              "type": "file",
              "name": "forecast_rollup_20260206.json",
              "url": "https://p-root.local/files/forecast_rollup_20260206.json",
              "highlight_text": "forecast_weight=2164",
              "highlight_anchor": "$.rollingForecast.today"
            }
          ]
        },
        {
          "source_version": "model-2.3.9",
          "snapshot_at": "2026-02-05 11:00:00",
          "display_value": "2,149g",
          "logic_summary": "초기 버전 오늘 셀 예측값",
          "confidence": 0.78,
          "data_source": [
            {
              "source_id": "db:forecast_matrix_snapshot:2026-02-05",
              "type": "db",
              "name": "forecast_matrix_snapshot",
              "url": "https://p-root.local/db/forecast_matrix_snapshot?date=2026-02-05",
              "row_id": "house=H01,age=35",
              "highlight_text": "predicted=2149",
              "highlight_anchor": "house=H01,age=35"
            }
          ]
        }
      ]
    }
  }
}
